[
  {
    "name": "Bella",
    "animal": "dog",
    "breed": "Labrador Mix",
    "age": 2,
    "medicalCondition": "Healthy, vaccinated. Up to date on all shots and spayed. Great with kids and other dogs."
  },
  {
    "name": "Milo",
    "animal": "cat",
    "breed": "Tabby",
    "age": 1,
    "medicalCondition": "Mild food allergy. Requires special diet but otherwise healthy. Indoor cat, very affectionate."
  },
  {
    "name": "Rocky",
    "animal": "dog",
    "breed": "Beagle",
    "age": 3,
    "medicalCondition": "Healthy, microchipped. Excellent hunting instincts, needs active family."
  },
  {
    "name": "Luna",
    "animal": "cat",
    "breed": "Siamese",
    "age": 0.7,
    "medicalCondition": "Healthy kitten. Very playful and vocal, typical Siamese personality."
  },
  {
    "name": "Coco",
    "animal": "dog",
    "breed": "Pomeranian",
    "age": 4,
    "medicalCondition": "Patella Grade 1 (minor). Manageable condition, requires gentle exercise."
  },
  {
    "name": "Buddy",
    "animal": "dog",
    "breed": "Golden Retriever",
    "age": 2,
    "medicalCondition": "Healthy, well-trained. Excellent family dog, loves swimming and fetch."
  },
  {
    "name": "Kiwi",
    "animal": "bird",
    "breed": "Cockatiel",
    "age": 1.2,
    "medicalCondition": "Healthy, very social bird. Loves to sing and whistle, hand-trained."
  },
  {
    "name": "Thumper",
    "animal": "rabbit",
    "breed": "Mini Rex",
    "age": 2.4,
    "medicalCondition": "Healthy, litter trained. Gentle temperament, good with children."
  },
  {
    "name": "Bubbles",
    "animal": "fish",
    "breed": "Betta",
    "age": 0.3,
    "medicalCondition": "Healthy, vibrant colors. Requires heated tank, cannot be with other bettas."
  },
  {
    "name": "Nibbles",
    "animal": "hamster",
    "breed": "Syrian",
    "age": 0.8,
    "medicalCondition": "Healthy, very active at night. Needs spacious cage with exercise wheel."
  },
  {
    "name": "Shadow",
    "animal": "cat",
    "breed": "Maine Coon",
    "age": 5,
    "medicalCondition": "Healthy, large breed cat. Very gentle giant, good with families."
  },
  {
    "name": "Max",
    "animal": "dog",
    "breed": "German Shepherd",
    "age": 3.5,
    "medicalCondition": "Healthy, well-trained guard dog. Needs experienced owner, excellent with training."
  },
  {
    "name": "Whiskers",
    "animal": "cat",
    "breed": "Persian",
    "age": 6,
    "medicalCondition": "Healthy, requires daily grooming. Calm personality, prefers quiet homes."
  },
  {
    "name": "Charlie",
    "animal": "dog",
    "breed": "French Bulldog",
    "age": 2.5,
    "medicalCondition": "Healthy, brachycephalic breed. Needs climate-controlled environment."
  },
  {
    "name": "Sunny",
    "animal": "bird",
    "breed": "Canary",
    "age": 1.8,
    "medicalCondition": "Healthy, beautiful singer. Prefers to be in pairs or groups."
  },
  {
    "name": "Pepper",
    "animal": "rabbit",
    "breed": "Holland Lop",
    "age": 1.5,
    "medicalCondition": "Healthy, very social rabbit. Needs daily exercise and companionship."
  },
  {
    "name": "Goldie",
    "animal": "fish",
    "breed": "Goldfish",
    "age": 2,
    "medicalCondition": "Healthy, requires large tank. Can live 10-20 years with proper care."
  },
  {
    "name": "Peanut",
    "animal": "hamster",
    "breed": "Dwarf",
    "age": 0.5,
    "medicalCondition": "Healthy, very small breed. Needs appropriate sized accessories."
  },
  {
    "name": "Duchess",
    "animal": "cat",
    "breed": "Russian Blue",
    "age": 4,
    "medicalCondition": "Healthy, hypoallergenic breed. Quiet and reserved personality."
  },
  {
    "name": "Zeus",
    "animal": "dog",
    "breed": "Great Dane",
    "age": 1.5,
    "medicalCondition": "Healthy puppy, will be very large. Needs experienced large breed owner."
  }
]